CNUM,TEXT_MANID,TEXT_UNIID,TEXT_PART,TEXT_Q,TEXT_BASIS,TEXT_TITLE,TEXT_TITLEQ,TEXT_TITLELOC,TEXT_TITLELOCQ,TEXT_TITLEBASIS,TEXT_LOC,TEXT_LOCCLASS,TEXT_LOCBASIS,TEXT_SEQUENCE,INC_EXP_CLASS,INCIPIT,INCIPIT_LOC,EXPLICIT,EXPLICIT_LOC,CONDITION,POETIC_FORM,POETIC_STANZA,DOCUMENT_LANGUAGE,COMMENT_TITLE,COMMENT_INCIPIT,COMMENT_LOC,COMMENT_Q,COMMENT_BASIS,COMMENT_BIOID,COMMENT_BIOIDQ,COMMENT_BIOBASIS,VARIANT_NAMECLASS,VARIANT_NAME,VARIANT_NAMELOC,VARIANT_NAMEQ,VARIANT_NAMEBASIS,RELATED_BIOCLASS,RELATED_BIODETAIL,RELATED_BIOID,RELATED_BIOIDQ,RELATED_BIOBD,RELATED_BIOBDQ,RELATED_BIOED,RELATED_BIOEDQ,RELATED_BIOBASIS,RELATED_BIBCLASS,RELATED_BIBID,RELATED_BIBVOL,RELATED_BIBLOC,RELATED_BIBITEM,RELATED_MANCLASS,RELATED_MANID,RELATED_MANVOL,RELATED_MANLOC,RELATED_MANITEM,RELATED_UNICLASS,RELATED_UNIDETAIL,RELATED_UNIID,RELATED_UNIBASIS,SUBJECT_BIOID,SUBJECT_GEOID,SUBJECT_INSID,SUBJECT_SUBID,PERIOD_BD,PERIOD_BDQ,PERIOD_ED,PERIOD_EDQ,PERIOD_BASIS,NOTES,VERIFY,STATUS,ENTERED,ENTERED_BY,UPDATED,UPDATED_BY,INTERNET_CLASS,INTERNET_ADDRESS,INTERNET_SERVICE,INTERNET_LASTSEEN,MONIKER
11,BETA manid 1001,BETA texid 1001,versión regia,,Hijano 2011,libro del Regim{SS}o{ES} delos señor{I}e{/I}s,,8r,,Faulhaber,3r-86v,ANALYTIC*TEXT_LOCCLASS*FF,Faulhaber,10.0,ANALYTIC*INC_EXP_CLASS*RUBR,aq{I}ui{/I} comjença vn libro conpuesto ⁊ sacado de muchas | abtoridades dela santa esc{I}ri{/I}ptura,3r,t{I}ra{/I}va|ja{I}r{/I} por subjr alos çelestiales E ꝑdurables q̃ enla ot{I}r{/I}{SS}a{ES} les | p{I}r{/I}{SS}o{ES}metio,6r,incompl.; según las tablas debe contener 57 caps.; lacuna desde el 25 hasta parte del 52,,,,,,,,,,,,,,,,,,Desde,BETA bioid 3368,,,,,,,ANALYTIC*RELATED_BIBCLASS*BED,BETA bibid 2622,II,119,ALB,ANALYTIC*RELATED_MANCLASS*CMP,BETA manid 1026,,,,ANALYTIC*RELATED_UNICLASS*CMP,Conoció la,BETA texid 1129,Hijano Villegas 2011,,,,BETA subid 1266,,,,,,Los textos de los ff. 85r-87ra parecen añadidos posteriores,,ANALYTIC*STATUS*1DC,1985-07-10,FAULHABER,2024-02-23,FAULHABER,UNIVERSAL*INTERNET_CLASS*URL,http://www.hispanicseminary.org/t&c/ac/index-en.htm,HSMS,2013-10-11,"MS: Juan de Alarcón y Valverde, Libro del regimiento de los señores, escrito 1423-09-10 a quo - 1451 ad quem. Madrid: Nacional (BNE), MSS/9477, 1423-09-10 a quo - 1455 ad quem"
12,BETA manid 1010,BETA texid 1005,caps. 229-723,?,Zarco,Historia de España que es llamada la noble. Año de jVccij,,1r,,Zarco,1r-324v,ANALYTIC*TEXT_LOCCLASS*FF,Zarco,10.0,ANALYTIC*INC_EXP_CLASS*TEXT,…Esta muerte ouo. deste emperador dize otrosi en su estoria. assi el emperador comodo,1r,Andados doze annos del regnado del Rey don sancho que fue en la era de iv & lxx…,180v,incompl. al comienzo y final,,,ANALYTIC*DOCUMENT_LANGUAGE*ARAGONESADO,,[q]{SS}10{ES}Uia per mẽtis infir/|mitatẽ ad virtutus ſtatũ,[I]{SS}va{ES},,prólogo,BETA bioid 1232,,,ANALYTIC*VARIANT_NAMECLASS*AUTHOR,Aly fide aben Ragel,,,Faulhaber,,Con prólogo de,BETA bioid 1115,,,,,,Zarco,ANALYTIC*RELATED_BIBCLASS*INEX,BETA bibid 1015,I,394-97,B,ANALYTIC*RELATED_MANCLASS*APO,BETA manid 1012,,,,,Según Menéndez Pidal 1955 se trata de un MS de,BETA texid 1005,Fernández-Ordóñez 2000: “Testimonios”,,BETA geoid 1030,,BETA subid 1266,,,,,,"Es una abreviación de la {I}Estoria de España{/I}, caps. 229-723 de la ed. de Menéndez Pidal. Zarco transcribe el pasaje (ff. 14r-16v) sobre el emperador Julián el apóstata, que no consta en la ed.",DOC_TITLE,ANALYTIC*STATUS*2I,1985-07-10,CARDENAS,2012-01-12,App Service - MCR,UNIVERSAL*INTERNET_CLASS*URL,http://www.hispanicseminary.org/t&c/ac/index-en.htm,HSMS,2013-10-14,"MS: Alfonso X, rey de Castilla y León, Corona de, Estoria de España (versión primitiva), escrito 1270 a quo - 1274 ad quem. San Lorenzo de El Escorial: Escorial: Monasterio, K.II.3, 1301 - 1400"
13,BETA manid 1094,BETA texid 1026,1-2,?,Kasten & Nitti,Ordenamjento delos tafures,,1r,,Faulhaber,50r-53v,ANALYTIC*TEXT_LOCCLASS*FF,{I}IGM{/I},100.0,ANALYTIC*INC_EXP_CLASS*RUBR,Este es el libro que yo maestre Roldan ordene en rrason delas tafurerias,50r,de murçia de jahen de algarbe,53v,fragm.: índices,cuaderna vía,35 x 9,ANALYTIC*DOCUMENT_LANGUAGE*RIOJANO,Glosa en prosa y verso del Tractado del Arte de cortar del cuchillo,Deueys saber q̃ | eneste metro bo|eçio habla,5v (margen),,,BETA bioid 1324,,Zarco,ANALYTIC*VARIANT_NAMECLASS*AUTHOR,"fferrandes, toribio",80r,,Zarco,ANALYTIC*RELATED_BIOCLASS*NOTA,En el arreglo de,BETA bioid 6347,?,,,,,Faulhaber,ANALYTIC*RELATED_BIBCLASS*CAT,BETA bibid 1882,I,39,Af10,ANALYTIC*RELATED_MANCLASS*CMP,BETA manid 1076,,99rb-102ra,,ANALYTIC*RELATED_UNICLASS*CMP,Identificado erróneamente por Pérez Llamazares como un ejemplar de,BETA texid 1029,Menéndez Pidal 1918,BETA bioid 2609,BETA geoid 1030,,BETA subid 1266,,,,,,"Gago 2013, siguiendo las normas del HSMS, numera los ff. del MS consecutivamente, haciendo caso omiso de la fol. original",expl.: f. 136rb “pora contar las tus marauillas (reclamo: De mas a tu vegedat)”,ANALYTIC*STATUS*2I,1985-07-10,FAULHABER,1988-08-14,FAULHABER,UNIVERSAL*INTERNET_CLASS*URL,http://www.hispanicseminary.org/t&c/lex/index-en.htm,HSMS,2013-11-05,"MS: Alfonso X, rey de Castilla y León, Corona de ~ Roldán, maestre… Ordenamiento de las tafurerías, promulgado 1276. Lugar desconocido: Biblioteca desconocida, {I}olim{/I} Salazar y Castro, 1701? - 1800?"
14,BETA manid 1710,BETA texid 1459,2.1-249,?,Zarco,Adoracion al Crucificio,?,58r,?,Faulhaber,58ra-b,ANALYTIC*TEXT_LOCCLASS*F,Faulhaber 2003,20.0,ANALYTIC*INC_EXP_CLASS*TIT,Adoracion al crucificio fizo las Alonso de Cordoua,58r,do nos compro la salud | la muerte del rey de gloria,58rb34,"incompl. al final, faltando parte del antepenúltimo cap. y los 2 últimos (Zarco)",Tratado,158 x 8,ANALYTIC*DOCUMENT_LANGUAGE*ARAGONESADO,[Glosa],Para entendjmiento deste prouerbio es de presuponer lo que aristotiles pone,ii ra-lxxxiiiij vb,,,BETA bioid 1129,,Zarco,ANALYTIC*VARIANT_NAMECLASS*AUTHOR,"goer, juan",1ra,,Zarco,ANALYTIC*RELATED_BIOCLASS*AUTOR,Precedida a manera de intro. por una historia de los reyes godos procedente de,BETA bioid 1115,?,1295-08-08,,,,Marcos et al.,ANALYTIC*RELATED_BIBCLASS*VIFD,BETA bibid 7176,II,320-21,5383,ANALYTIC*RELATED_MANCLASS*CMP,BETA manid 3602,,43,,ANALYTIC*RELATED_UNICLASS*PAR,Glosas basadas en,BETA texid 2740,Weiss 2013,BETA bioid 4569,BETA geoid 1470,BETA insid 1043,BETA subid 1266,1432-03-06,,1448.0,,f. 95rb,Faulhaber: Descr. a base del ejemplar de la Huntington,NOTES,ANALYTIC*STATUS*1I,1985-07-10,FAULHABER,2008-11-28,FAULHABER,UNIVERSAL*INTERNET_CLASS*URL,http://www.hispanicseminary.org/t&c/nar/index-en.htm,HSMS,2013-10-16,"Ed.: Alonso de Córdoba, Adoración al crucifijo, escrito 1498 ad quem?. San Marino: Huntington (Rare Books), 94781. [Salamanca]: [Juan de Porras], 1499 ca."
15,BETA manid 4875,BETA texid 2803,6.2-8.124,?,Puig 2005,vn tratado q̃ fizo El muy çiente maestro en sancta | theologia El tostado obispo de aujla estando enel estudio . | por el q{I}ua{/I}l p{I}ru{/I}eua Com̃o al ome es neçesario Ama{I}r{/I} ⁊ el q̃ ama . | es Neçesario q̃ se turbe.,,1v,?,Faulhaber 2019,1v-7v,ANALYTIC*TEXT_LOCCLASS*FF,Paolini 2008,10.0,ANALYTIC*INC_EXP_CLASS*RUBR,A{SS}4{ES}q{I}ui{/I} comjença vn tratado q̃ fizo El muy çiente maestro en sancta | theologia El tostado obispo de aujla estando enel estudio . | por el q{I}ua{/I}l p{I}ru{/I}eua Com̃o al ome es neçesario Ama{I}r{/I} ⁊ el q̃ ama . | es Neçesario q̃ se turbe.,1v,ansy faze | el Amor al q̃ Ama . eñste grado lo yguala Salomõ segũ pareçe | en aq̃lla abtoridad es{I}cript{/I}a [?] eñl eclesiastico onde dize El vjno ⁊ el …,7v,Incompl. al final,cuaderna vía,"4, 4",ANALYTIC*DOCUMENT_LANGUAGE*LEONES,[comentario],Aq̃sta | copla que es comienço ᵭl dezir,2rb,,,BETA bioid 5839,,Paolini 2008,ANALYTIC*VARIANT_NAMECLASS*AUTHOR,Gueuara,53r,,Dutton 1991,ANALYTIC*RELATED_BIOCLASS*AUTORIMPUTADO,posesor del original de esta copia,BETA bioid 1310,?,1591-07-20,ad quem,,,f. 117v,ANALYTIC*RELATED_BIBCLASS*BED,BETA bibid 4855,II,"92, 105",205,ANALYTIC*RELATED_MANCLASS*CO?,BETA manid 1040,I,15r-30r,"ç,IV.9",ANALYTIC*RELATED_UNICLASS*CON,El último cap se basa en,BETA texid 3259,Willis,BETA bioid 2452,BETA geoid 1689,BETA insid 1126,BETA subid 1027,1499-10-14,,,,,Ínc. y éxpl.de Paolini 2009 suplementados por Faulhaber 2019,DOC_LOC,ANALYTIC*STATUS*1C,2008-12-04,FAULHABER,2019-10-10,FAULHABER,UNIVERSAL*INTERNET_CLASS*URL,http://www.ucm.es/BUCM/tesis/19972000/H/3/H3050601.pdf,FactGrid,2010-03-01,"MS: Desconocido… Tratado de cómo al hombre es necesario amar, escrito 1445 a quo - 1455-09-03 ad quem. Madrid: Nacional (BNE), MSS/18665/30, 1491 ca. - 1500 ca."
